<?xml version="1.0" encoding="UTF-8"?>
<!-- edited with XMLSpy v2008 rel. 2 (http://www.altova.com) by mazuki (darksiderg) -->
<!--W3C Schema generated by XMLSpy v2008 rel. 2 (http://www.altova.com)-->
<xs:schema xmlns:xs="http://www.w3.org/2001/XMLSchema">
	<xs:element name="ECN-Words">
		<xs:complexType>
			<xs:sequence>
				<xs:element ref="ECN-Game-Words"/>
				<xs:element ref="ECN-Black-Words"/>
			</xs:sequence>
		</xs:complexType>
	</xs:element>
	<xs:element name="ECN-Team2">
		<xs:complexType>
			<xs:attribute name="name" type="xs:string" use="required"/>
			<xs:attribute name="cards-count" type="xs:int" use="required"/>
		</xs:complexType>
	</xs:element>
	<xs:element name="ECN-Team1">
		<xs:complexType>
			<xs:attribute name="name" type="xs:string" use="required"/>
			<xs:attribute name="cards-count" type="xs:int" use="required"/>
		</xs:complexType>
	</xs:element>
	<xs:element name="ECN-Layout">
		<xs:complexType>
			<xs:attribute name="rows" type="xs:int" use="required"/>
			<xs:attribute name="columns" type="xs:int" use="required"/>
		</xs:complexType>
	</xs:element>
	<xs:element name="ECN-Game-Words" type="xs:string"/>
	<xs:element name="ECN-Game">
		<xs:complexType>
			<xs:sequence>
				<xs:element ref="ECN-Words"/>
				<xs:element ref="ECN-Board"/>
				<xs:element ref="ECN-Team1"/>
				<xs:element ref="ECN-Team2"/>
			</xs:sequence>
		</xs:complexType>
	</xs:element>
	<xs:element name="ECN-Board">
		<xs:complexType>
			<xs:sequence>
				<xs:element ref="ECN-Layout"/>
			</xs:sequence>
			<xs:attribute name="cards-count" type="xs:int" use="required"/>
			<xs:attribute name="black-cards-count" type="xs:int" use="required"/>
		</xs:complexType>
	</xs:element>
	<xs:element name="ECN-Black-Words" type="xs:string"/>
</xs:schema>
