<?xml version="1.0" encoding="UTF-8"?>
<ECN-Game xmlns:xsi="http://www.w3.org/2001/XMLSchema-instance" xsi:noNamespaceSchemaLocation="CodeNames-v1.xsd">
	<ECN-Words>
		<ECN-Game-Words>
encapsulation german poland kombat waffele whom leg character terms else camel rabbit fire text element sky item robot past dune dolphine then it am quality eye moon system folder light letter number notch allies dog word hash why gun pink what yellow sea see noon file top does ear can't table foot hand a strike black electricity pistol kill boat democracy off battle single fly component blue watch reflector future machine progress atom under inferno voice rotor tonight 	
		</ECN-Game-Words>
		<ECN-Black-Words>
mouce door data use doom sign screen do bomb red later whale white hello than which england morning dirt tree thrown water trash ranch she sand squad desk present where magenta game code enigma plural death vegtable fruit for their privacy back house fox not hair napkin and street cat now of iteration class trike fight mortal live how on patrol keyboard midnight or green umbrella wheel saw orange airplane window front		
		</ECN-Black-Words>
	</ECN-Words>
	<ECN-Board cards-count="24" black-cards-count="1">
		<ECN-Layout rows="5" columns="5"/>
	</ECN-Board>
	<ECN-Team1 name="T1" cards-count="9"/>
	<ECN-Team2 name="T2" cards-count="8"/>
</ECN-Game>
